### ISSUE TITLE
Port documentation required

### ISSUE THREAD

**Issue by SimplyCorbett** [Chocobozzz/PeerTube#6254]
### Describe the desired information/correction

With peertube I am using the default nginx config. The backend the nginx config connects to for port 9000 is on an internal IP on another server with wireguard.

i.e:

```
upstream backend3 {
        server 10.10.10.2:9000;
}
```

When peertube listens to 10.10.10.2 and is connected to the internal IP, the following is shown in tcpdump:

```
08:22:43.846137 IP 10.10.10.1.51732 > 10.10.10.2.9000: Flags [.], ack 1573525, win 12782, options [nop,nop,TS val 3965625316 ecr 2167835780], length 0

08:22:43.846137 IP 10.10.10.1.51732 > 10.10.10.2.9000: Flags [.], ack 1576141, win 12802, options [nop,nop,TS val 3965625316 ecr 2167835780], length 0

08:22:43.846137 IP 10.10.10.1.51732 > 10.10.10.2.9000: Flags [.], ack 1578757, win 12802, options [nop,nop,TS val 3965625316 ecr 2167835780], length 0

08:22:43.839160 IP 10.10.10.2.9000 > 10.10.10.1.51732: Flags [P.], seq 2689249:2746801, ack 588, win 251, options [nop,nop,TS val 2167835806 ecr 3965625309], length 57552

08:22:43.839719 IP 10.10.10.2.9000 > 10.10.10.1.51732: Flags [P.], seq 2746801:2753341, ack 588, win 251, options [nop,nop,TS val 2167835806 ecr 3965625309], length 6540

08:22:27.269376 IP 10.10.10.1.40540 > 10.10.10.2.9000: Flags [.], ack 2546677, win 13537, options [nop,nop,TS val 3965608739 ecr 2167819202], length 0

08:22:27.269385 IP 10.10.10.1.40540 > 10.10.10.2.9000: Flags [.], ack 2549293, win 13537, options [nop,nop,TS val 3965608739 ecr 2167819202], length 0

08:22:27.269444 IP 10.10.10.1.40540 > 10.10.10.2.9000: Flags [.], ack 2551909, win 13537, options [nop,nop,TS val 3965608739 ecr 2167819203], length 0
```

It is therefore not possible to restrict open ports on this IP for security purposes as port 9000 is not the only required port. However, the ports appear to be random and I don't know which ports to allow on the firewall.

Is there any documentation for this?

**Comment by SimplyCorbett** [comment]
And yes, if the IP doesn't have any restricted ports on the firewall this setup works. But I'd like to not have a completely unrestricted IP even if it is on the internal network.

**Comment by Chocobozzz** [comment]
Hello,

From what I see `10.10.10.2` always use port `9000` so I'm not sure to understand the issue?
